url,title,published,reason,kept_twin
https://frontpageafricaonline.com/news/liberia-lta-awards-starlink-one-year-provisional-licensing-agreement-to-provide-full-internet-service-across-liberia/,Liberia: LTA Awards Starlink One-Year Provisional Licensing Agreement,2024-10-11,out-of-window,
https://frontpageafricaonline.com/opinion/press-release/liberia-nir-excited-over-president-boakai-support-to-compulsory-citizens-enrollment/,Liberia: NIR Excited Over President Boakai Support to Compulsory Citizens Enrollment,2025-05-06,pr-wire-better-twin,2025-04-30-no-national-id-no-transaction-eo147-observer.md
https://www.liberianobserver.com/news/stakeholders-to-validate-draft-data-privacy-legislation-today/article_1125d004-bc38-11ef-ad7b-cf4c9a309331.html,Stakeholders to Validate Draft Data Privacy Legislation Today,2024-12-17,out-of-window,
https://techafricanews.com/2026/06/11/liberia-secures-us125-million-world-bank-financing-for-infrastructure-energy-and-digital-projects/,Liberia Secures US$125 Million World Bank Financing for Infrastructure Energy and Digital Projects,2026-06-11,same-outlet-recrawl,2026-06-08-125m-world-bank-wardip2-financing-techafricanews.md
https://techafricanews.com/2026/05/14/where-is-africas-data-actually-being-stored/,Where Is Africa's Data Actually Being Stored?,2026-05-14,off-topic,
