url,title,published,reason,kept_twin
https://theseychellestimes.com/2026/07/09/seychelles-revenue-commission-cheque-phase-out-2028/,Seychelles Revenue Commission Sets Cheque Phase-Out by 2028,2026-07-09,same-event rewrite of Nation report,nation.sc/articles/31435 (SRC cheque phase-out)
https://theseychellestimes.com/2026/06/09/peace-submarine-cable-strengthens-seychelles-international-connectivity/,PEACE Submarine Cable Strengthens Seychelles International Connectivity,2026-06-09,low-novelty reference rehash of 2022 PEACE landing,n/a
https://getfinancebrief.com/story/upi-seychelles-fintech,UPI Goes to Seychelles NPCI-Central Bank MoU Signed,2026-06-29,AI-synthesis intelligence brief (inadmissible),africabusinessinsight.com/seychelles-upi-launch-2026
https://satnanews.net/2026/07/03/india-confirms-upi-launch-in-seychelles-by-year-end-digital-payments-cross-anoth/,India Confirms UPI Launch in Seychelles by Year-End,2026-07-03,aggregator/secondary UPI item,africabusinessinsight.com/seychelles-upi-launch-2026
https://curlytales.com/india/trending/upi-to-be-available-in-seychelles-soon-india-seychelles-seal-deal-to-expand-digital-payments/,UPI To Be Available In Seychelles Soon,2026-06-28,India consumer aggregator secondary,africabusinessinsight.com/seychelles-upi-launch-2026
https://www.convergence-now.com/fintech/upi-in-seychelles-india-signs-deal-to-expand-digital-payments-network/,UPI in Seychelles India Signs Deal,2026-06-30,secondary aggregator,africabusinessinsight.com/seychelles-upi-launch-2026
https://fintechbiznews.com/fintech-digital-payment-/nipl--seychelles-central-bank-sign-mou,NIPL-Seychelles Central Bank Sign MoU,,secondary trade re-report of UPI MoU,africabusinessinsight.com/seychelles-upi-launch-2026
https://securityaffairs.com/180513/data-breach/seychelles-commercial-bank-reported-cybersecurity-incident.html,Seychelles Commercial Bank Reported Cybersecurity Incident,2025-07-29,syndicated breach coverage,bankinfosecurity.com/...-a-28972 + resecurity.com blog
https://www.databreachtoday.com/seychelles-commercial-bank-confirms-customer-data-breach-a-28972,Seychelles Commercial Bank Confirms Customer Data Breach,2025-07-15,ISMG-network duplicate of keeper,bankinfosecurity.com/...-a-28972
https://www.inforisktoday.com/seychelles-commercial-bank-confirms-customer-data-breach-a-28972,Seychelles Commercial Bank Confirms Customer Data Breach,2025-07-15,ISMG-network duplicate of keeper,bankinfosecurity.com/...-a-28972
https://www.occrp.org/en/news/hacker-claims-to-breach-seychelles-bank-offers-client-data-for-sale,Hacker Claims to Breach Seychelles Bank,,secondary breach coverage,bankinfosecurity.com/...-a-28972
https://www.indrastra.com/2025/07/seychelles-cybersecurity-wake-up-call.html,Seychelles Cybersecurity Wake-Up Call,2025-07-01,secondary analysis blog,bankinfosecurity.com/...-a-28972
https://theseychellesindependent.com/2026/02/12/starlink-internet-to-be-introduced-soon-announces-president/,Starlink Internet to be introduced soon announces President,2026-02-12,local opinion/analysis column - Starlink thread primaries staged,nation.sc/articles/29683 + 30901
https://theseychellesindependent.com/2026/04/24/starlink-in-seychelles-what-is-causing-the-delay/,Starlink in Seychelles what is causing the delay,2026-04-24,opinion column,nation.sc/articles/29683 + 30901
https://theseychellesindependent.com/2026/05/15/starlink-arrives-in-seychelles-the-end-of-the-cable-wireless-era/,Starlink arrives the end of the Cable Wireless era,2026-05-15,opinion column,nation.sc/articles/29683 + 30901
https://theseychellesindependent.com/2026/05/29/negotiations-with-starlink-at-an-advanced-stage/,Negotiations with Starlink at an advanced stage,2026-05-29,opinion column duplicate of NA statement,nation.sc/articles/30901
https://theseychellesindependent.com/2026/06/05/will-cable-wireless-seychelles-sink-or-swim-with-the-arrival-of-starlink/,Will Cable Wireless sink or swim with Starlink,2026-06-05,opinion column,nation.sc/articles/29683
https://ts2.tech/en/10-gbps-in-paradise-inside-seychelles-high-speed-internet-revolution-and-the-satellite-showdown/,10 Gbps in Paradise,2025-05-29,SEO secondary blog,n/a
https://maarcofrancis.com/trends-and-insights/5g-networks-remote-island-communities-seychelles/,How 5G Networks Transform Remote Island Communities,2025-11-19,SEO/AI-style personal blog (inadmissible),n/a
https://maarcofrancis.com/leadership-values/digital-twin-technology-urban-planning-seychelles/,Digital Twin Technology for Urban Planning in Seychelles,2025-11-19,SEO/AI-style personal blog (inadmissible),n/a
https://www.nucamp.co/blog/coding-bootcamp-seychelles-syc-government-how-ai-is-helping-government-companies-in-seychelles,How AI is Helping Government Companies in Seychelles,2025-09-13,bootcamp SEO blog (inadmissible),n/a
https://www.transfi.com/blog/seychelles-payment-rails-how-they-work,Seychelles Payment Rails How They Work,2025-08-16,vendor promo blog,n/a
https://www.linkedin.com/pulse/small-islands-strategic-advantage-how-seychelles-can-become-brendon-ze85f,Small Islands Strategic Advantage,2026-06-23,self-published LinkedIn opinion,n/a
https://www.reseauconsulting.com/post/island-hydrospatial-observatory,Building an Island Hydrospatial Observatory (SHORE),2026-01-26,consulting blog opinion (SHORE = entity lead),n/a
https://realassetinsight.com/feature/seychelles-aligns-digital-growth-with-sustainable-investment-goals/,Seychelles aligns digital growth with sustainable investment goals,2026-06-01,secondary investment-analysis piece,n/a
https://datareportal.com/reports/digital-2026-seychelles,Digital 2026 Seychelles,2025-11-08,reference statistical study (cite-not-absorb; resource entity at ingest),n/a
https://afi-global.org/opinion/seychelles-cybersecurity-journey/,Central Bank of Seychelles cybersecurity journey,2026-04-21,member opinion piece,n/a
https://www.nationalassembly.sc/legislation/bills/national-institute-science-technology-and-innovation-bill-2025-bill-no-27-2025,National Institute of Science Technology and Innovation Bill 2025,2025-12-15,superseded by enacted Act 24 of 2025,gazette.sc Act 24 2025 (staged)
https://www.6wresearch.com/industry-report/seychelles-data-center-services-market,Seychelles Data Center Services Market 2025-2031,,paywalled market forecast (promo),n/a
